{
  "name": "[DEFAULT VALUES]",
  "image_path": "",
  "boolean_properties": {
    "red": false,
    "blue": false,
    "star": false,
    "circle": false,
    "car": false,
    "small": false,
    "large": false,
    "Music_instument": false,
    "brown": false,
    "is_food": false,
    "is_sweet": false,
    "yellow": false,
    "fruit": false,
    "orange": false,
    "black": false,
    "purple": false,
    "green": false,
    "lego": false,
    "stackable": false,
    "bag": false,
    "book": false,
    "sharp": false,
    "calculator": false,
    "hot": false,
    "used_for_cooking": false,
    "holds_water": false,
    "valuable": false,
    "cold": false,
    "shoe": false,
    "camera": false,
    "clothes": false,
    "shirt": false,
    "plant": false,
    "holds_money": false,
    "socks": false,
    "dress": false
  },
  "scalar_properties": {
    "size": 1
  }
}